{
  "schemaVersion": "1.0.0",
  "profile": {
    "id": "andrew-pella",
    "name": "Andrew Pella",
    "workingTitle": "Technical Product & Program Leader | Enterprise Technology | Infrastructure & Operations",
    "positioning": "Technology leader spanning technical product management, program leadership, enterprise infrastructure, IT operations, enterprise platforms, endpoint and digital workplace services, observability platform product leadership, automation, and AI-assisted operations.",
    "location": "Oregon, United States",
    "canonicalUrl": "https://andrewpella.com",
    "summary": "Technology leader with experience spanning technical product management, program leadership, enterprise infrastructure, IT operations, observability platform product leadership, endpoint services, mobility, digital workplace, automation, and AI-assisted operations. Career combines hands-on engineering and architecture with senior individual-contributor Product Owner and Product Manager leadership.",
    "summaryDetail": "Experienced leading large-scale technology transformation from requirements and technical evaluation through proof of concept, pilot, implementation, deployment, production operations, modernization, and lifecycle management. Work has ranged from nationwide infrastructure deployments across more than 450 locations to global enterprise platforms supporting approximately 50,000–65,000 users and mobility environments encompassing approximately 70,000 managed devices."
  },
  "skills": [
    {"id":"product-management","label":"Technical Product Management","category":"leadership"},
    {"id":"product-leadership","label":"Product Leadership","category":"leadership"},
    {"id":"technical-program-leadership","label":"Technical Program Leadership","category":"leadership"},
    {"id":"product-operations","label":"Product Operations","category":"leadership"},
    {"id":"enterprise-infrastructure","label":"Enterprise Infrastructure","category":"domain"},
    {"id":"it-operations","label":"IT Operations","category":"domain"},
    {"id":"enterprise-platforms","label":"Enterprise Platforms","category":"domain"},
    {"id":"platform-modernization","label":"Platform Modernization","category":"domain"},
    {"id":"endpoint-services","label":"Endpoint & Mobility Management","category":"domain"},
    {"id":"digital-workplace","label":"Digital Workplace","category":"domain"},
    {"id":"it-service-delivery","label":"IT Service Delivery","category":"domain"},
    {"id":"observability","label":"Observability","category":"domain"},
    {"id":"sre-platforms","label":"SRE & Reliability","category":"domain","aliases":["Site Reliability Engineering","SRE"]},
    {"id":"logging","label":"Logging / Log Management","category":"domain"},
    {"id":"opentelemetry","label":"OpenTelemetry","category":"technology"},
    {"id":"incident-management","label":"Incident Management","category":"domain"},
    {"id":"automation","label":"Automation","category":"domain"},
    {"id":"enterprise-mobility","label":"Enterprise Mobility","category":"domain"},
    {"id":"ai-assisted-workflows","label":"AI-Assisted Operations","category":"ai"},
    {"id":"agentic-ai","label":"Agentic AI","category":"ai"}
  ],
  "experience": [
    {
      "id":"salesforce-sre-product",
      "employer":"Salesforce",
      "title":"Senior Product Manager",
      "functionalAssignment":"Product Owner / Product Manager, Site Reliability Engineering",
      "startDate":"2021-09",
      "endDate":"2026-10-05",
      "dateDisplay":"September 2021–October 5, 2026",
      "summary":"Product and portfolio leadership for four SRE teams covering Logging, Monitoring, Tools Development, and Incident Management, serving approximately 50,000 internal users.",
      "highlights":[
        "Led product and portfolio planning while managing approximately 50 intake requests per week across four independent backlogs and roadmaps.",
        "Built and maintained the combined SRE roadmap used for quarterly leadership and executive reviews, integrating priorities, capacity, commitments, metrics, KPIs, dependencies, risks, and decisions.",
        "Held product responsibility for Splunk, Logstash, New Relic, Grafana, PagerDuty, OpenTelemetry collectors, incident workflows, and technical-tool development.",
        "Led an OpenTelemetry client-reporting initiative from feasibility and development testing through production dual-run, security validation, and full production deployment across macOS and Windows clients, reducing client-side overhead and complexity while satisfying security requirements.",
        "Coordinated product owners, Logging, client engineering, security, and operations teams through requirements, implementation, blocker resolution, validation, and transition of production ownership.",
        "Designed and built a governed AI-assisted operational workflow that gathered team updates, identified blockers, and initiated follow-on work while retaining human approval, source traceability, validation, access controls, exception handling, failure routing, and audit records.",
        "Led implementation of the AI-assisted workflow across all four SRE teams using Claude CLI, ChatGPT, Codex, Slack, MCP, Linear, and GUS."
      ],
      "skillIds":["product-management","product-leadership","technical-program-leadership","product-operations","observability","sre-platforms","logging","opentelemetry","incident-management","automation","ai-assisted-workflows"]
    },
    {
      "id":"salesforce-mobile-windows-product",
      "employer":"Salesforce",
      "title":"Senior Product Manager",
      "functionalAssignment":"Product Owner / Product Manager, Enterprise Mobile and Windows Services",
      "startDate":"2020-03",
      "endDate":"2021-09",
      "dateDisplay":"March 2020–September 2021",
      "summary":"Product direction and delivery for global mobile-device and Windows services supporting approximately 65,000 users across Windows, iOS, and Android, including enterprise endpoint and digital-workplace services.",
      "highlights":[
        "Owned product workflows for Windows OS patching, OS configuration, user-access services, and enterprise mobility.",
        "Converted strategic roadmaps and stakeholder requirements into prioritized delivery work across engineering, security, architecture, operations, support, and partner organizations.",
        "Managed intake, requirements, backlog, dependencies, delivery coordination, operational readiness, service delivery, platform maintenance, and status reporting."
      ],
      "skillIds":["product-management","product-leadership","technical-program-leadership","enterprise-platforms","endpoint-services","digital-workplace","it-service-delivery","enterprise-mobility"]
    },
    {
      "id":"salesforce-client-engineering",
      "employer":"Salesforce",
      "title":"Senior Infrastructure Engineer — Client Engineering",
      "startDate":"2012-10",
      "endDate":"2020-03",
      "dateDisplay":"October 2012–March 2020",
      "summary":"Hands-on technical and architectural responsibility for Salesforce's greenfield AirWatch implementation and later AirWatch-to-Workspace ONE migration.",
      "highlights":[
        "Led the initiative from requirements and architecture through proof of concept, pilot, phased production rollout, integrations, operations, vendor coordination, and lifecycle support.",
        "Designed and coordinated infrastructure and integrations involving application servers, databases, load balancing, network access, email and calendar, identity, certificates, VPN, Wi-Fi, applications, content delivery, security, privacy, and compliance.",
        "Led the hands-on AirWatch-to-Workspace ONE migration across approximately 70,000 managed devices without requiring device re-enrollment and with minimal user disruption.",
        "Expanded enterprise mobility capabilities through Android Enterprise work profiles, enhanced device configuration, application catalogs, security controls, and usage intelligence."
      ],
      "skillIds":["enterprise-infrastructure","it-operations","enterprise-platforms","platform-modernization","endpoint-services","digital-workplace","it-service-delivery","enterprise-mobility"]
    },
    {
      "id":"portland-rescue-mission",
      "employer":"Portland Rescue Mission",
      "title":"IT Specialist",
      "startDate":"2012-06",
      "endDate":"2012-10",
      "dateDisplay":"June 2012–October 2012",
      "summary":"Sole IT specialist responsible for servers, networking, telephone systems, workplace technology, hardware, software, printing services, user access, and technical support.",
      "highlights":[
        "Completed the Office 365 deployment and provided limited Microsoft 365 administration in support of the organization's cloud email and collaboration environment.",
        "Implemented role-based access controls and an organizational badging system.",
        "Updated and patched servers and network devices, administered Active Directory, and resolved infrastructure and end-user issues across the organization."
      ],
      "skillIds":["enterprise-infrastructure","it-operations","enterprise-platforms","digital-workplace","it-service-delivery"]
    },
    {
      "id":"hp-technical-consultant",
      "employer":"HP",
      "title":"Technical Consultant",
      "startDate":"2010-09",
      "endDate":"2012-06",
      "dateDisplay":"September 2010–June 2012",
      "summary":"Continued technical architecture, enterprise client-computing, and third-tier engineering responsibilities after HP assumed responsibility for technology services supporting the Con-way environment.",
      "highlights":[
        "Designed and implemented Group Policy and Citrix controls for enterprise client environments.",
        "Supported production handheld technology used for freight scanning and tracking, dock loading and routing, shipment-status updates, and exception handling.",